{
  "id": "datainputschemaobj",
  "version": "1.0",
  "specVersion": "0.8",
  "name": "Data Input Schema test",
  "dataInputSchema": {
    "schema":null,
    "schemaContent":{
      "title": "MyJSONSchema",
      "properties":{
        "firstName":{
          "type": "string"
        },
        "lastName":{
          "type": "string"
        }
      }
    },
    "failOnValidationErrors": false
  },
  "start": "TestFunctionRefs",
  "states": [
    {
      "name": "TestFunctionRefs",
      "type": "operation",
      "actionMode": "sequential",
      "actions": [
        {
          "functionRef": "creditCheckFunction"
        },
        {
          "functionRef": {
            "refName": "sendRejectionEmailFunction",
            "arguments": {
              "applicant": "${ .customer }"
            }
          }
        }
      ],
      "end": true
    }
  ]
}
